<?xml version="1.0" encoding="UTF-8"?>
<Automachine  >
<!--   xmlns="http://mass.pku.edu.cn" xmlns:xsi="http://www.w3.org/2001/XMLSchema-instance" xsi:schemaLocation="http://mass.pku.edu.cn automachine.xsd" --> 
	<description>use IFNULL/IFNONNULL after calling readLine()</description>
	<errorMessage>use IFNULL/IFNONNULL after calling readLine()</errorMessage>
	<endMeanViolateDefect>true</endMeanViolateDefect>
	<objectSensitive>false</objectSensitive>
	<onlyConcernClass></onlyConcernClass>
	<allOpcodePushOjectAutomachine>false</allOpcodePushOjectAutomachine>	
	<severeLevel>0</severeLevel>
	<state>
		<number>1</number>
		<isEndState>false</isEndState>
		<isOriginState>true</isOriginState>
		<exceptionState>1</exceptionState>		
		<edge>
			<class>VisitMethodInsnEdge</class>
			<toState>2</toState>
			<opcode>INVOKEVIRTUAL</opcode>
			<owner>java/io/BufferedReader</owner>
			<name>readLine</name>
			<desc>()Ljava/lang/String;</desc>
		</edge>		
		<edge>
			<class>VisitMethodInsnEdge</class>
			<toState>2</toState>
			<opcode>INVOKEVIRTUAL</opcode>
			<owner>java/io/DataInputStream</owner>
			<name>readLine</name>
			<desc>()Ljava/lang/String;</desc>
		</edge>		
		<edge>
			<class>VisitMethodInsnEdge</class>
			<toState>2</toState>
			<opcode>INVOKEVIRTUAL</opcode>
			<owner>java/io/ObjectInputStream</owner>
			<name>readLine</name>
			<desc>()Ljava/lang/String;</desc>
		</edge>					
	</state>
	
	<state>
		<number>2</number>
		<isEndState>false</isEndState>
		<isOriginState>false</isOriginState>
		<exceptionState>1</exceptionState>	
		<edge>
			<class>VisitJumpInsnEdge</class>
			<toState>3</toState>
			<opcode>IFNULL</opcode>			
		</edge>
		<edge>
			<class>VisitJumpInsnEdge</class>
			<toState>3</toState>
			<opcode>IFNONNULL</opcode>		
		</edge>	
	</state>
	
	<state>
		<number>3</number>		
		<isEndState>true</isEndState>
		<isOriginState>false</isOriginState>
		<exceptionState>3</exceptionState>
	</state>	
</Automachine>