<?xml version="1.0" encoding="UTF-8"?>
<Automachine  >
<!--   xmlns="http://mass.pku.edu.cn" xmlns:xsi="http://www.w3.org/2001/XMLSchema-instance" xsi:schemaLocation="http://mass.pku.edu.cn automachine.xsd" --> 
	<description>i2d then call Math.ceil() or Math.round()</description>
	<errorMessage>i2d then call Math.ceil() or Math.round()</errorMessage>
	<endMeanViolateDefect>true</endMeanViolateDefect>
	<objectSensitive>false</objectSensitive>
	<onlyConcernClass></onlyConcernClass>
	<allOpcodePushOjectAutomachine>false</allOpcodePushOjectAutomachine>	
	<severeLevel>0</severeLevel>
	<state>
		<number>1</number>
		<isEndState>false</isEndState>
		<isOriginState>true</isOriginState>
		<exceptionState>1</exceptionState>		
			<edge>
				<class>VisitInsnEdge</class>
				<toState>2</toState>
				<opcode>I2D</opcode>
				
			</edge>
			<edge>
				<class>VisitInsnEdge</class>
				<toState>2</toState>
				<opcode>fconst_1</opcode>
				
			</edge>
			<edge>
				<class>VisitInsnEdge</class>
				<toState>2</toState>
				<opcode>dconst_1</opcode>
				
			</edge>
			<edge>
				<class>VisitInsnEdge</class>
				<toState>2</toState>
				<opcode>ldc2_w</opcode>
				
			</edge>
		
	</state>
	
	<state>
		<number>2</number>
		<isEndState>false</isEndState>
		<isOriginState>false</isOriginState>
		<exceptionState>1</exceptionState>
		
			<edge>
				<class>VisitMethodInsnEdge</class>
				<toState>3</toState>
				<opcode>INVOKESTATIC</opcode>
				<owner>java/lang/Math</owner>
				<name>ceil</name>
				<desc>(D)D</desc>
			</edge>
			<edge>
				<class>VisitMethodInsnEdge</class>
				<toState>3</toState>
				<opcode>INVOKESTATIC</opcode>
				<owner>java/lang/Math</owner>
				<name>round</name>
				<desc>(F)I</desc>
			</edge>
			
		
		
	</state>
	
	<state>
		<number>3</number>		
		<isEndState>true</isEndState>
		<isOriginState>false</isOriginState>
		<exceptionState>3</exceptionState>
	</state>
	


</Automachine>